<!--
02.03.2020
Generated by https://www.freeformatter.com/xsd-generator.html
    and modified by Martin Ludwig
-->


<xs:schema attributeFormDefault="unqualified" elementFormDefault="qualified">
    <xs:element name="skills">
        <xs:complexType>
            <xs:sequence>
                <xs:element name="skill" maxOccurs="unbounded" minOccurs="0">
                    <xs:complexType>
                        <xs:sequence>
                            <xs:element type="xs:string" name="name"/>
                            <xs:element type="xs:string" name="description"/>
                            <xs:element name="priority">
                                <xs:simpleType>
                                    <xs:restriction base="xs:byte">
                                        <xs:minInclusive value="0"/>
                                        <xs:maxInclusive value="6"/>
                                    </xs:restriction>
                                </xs:simpleType>
                            </xs:element>
                            
                            <xs:element name="moduletype">
                                <xs:complexType>
                                    <xs:sequence>
                                        <xs:element type="xs:string" name="type" maxOccurs="unbounded" minOccurs="0"/>
                                    </xs:sequence>
                                </xs:complexType>
                            </xs:element>
                        </xs:sequence>
                        <xs:attribute type="xs:integer" name="id" use="required"/>
                    </xs:complexType>
                </xs:element>
            </xs:sequence>
            <xs:attribute type="xs:string" name="version" use="optional"/>
        </xs:complexType>
        <xs:unique name="skillID">
            <xs:selector xpath="skill"/>
            <xs:field xpath="@id"/>
        </xs:unique>
    </xs:element>
</xs:schema>